{
  "title": "OpenEngineAtlas",
  "last_verified": "2026-10-05",
  "criteria": "Projects are included when their engine/tool source is available under a recognized free/open-source software license. Frameworks and interpreters are explicitly labeled.",
  "engines": [
    {
      "name": "Godot Engine",
      "category": "general-2d-3d",
      "type": "engine",
      "dimensions": "2D + 3D",
      "languages": "C++ engine; GDScript, C#, C++",
      "license": "MIT",
      "workflow": "Visual editor + scripting",
      "website": "https://godotengine.org/",
      "source": "https://github.com/godotengine/godot",
      "notes": "General-purpose cross-platform engine with dedicated 2D and 3D workflows."
    },
    {
      "name": "GDevelop",
      "category": "general-2d-3d",
      "type": "engine",
      "dimensions": "2D + 3D",
      "languages": "TypeScript / JavaScript",
      "license": "MIT (core engine, IDE, extensions)",
      "workflow": "Visual/no-code events + JavaScript",
      "website": "https://gdevelop.io/",
      "source": "https://github.com/4ian/GDevelop",
      "notes": "Accessible visual engine with 2D, 3D and multiplayer features."
    },
    {
      "name": "Stride",
      "category": "general-2d-3d",
      "type": "engine",
      "dimensions": "2D + 3D",
      "languages": "C# / .NET",
      "license": "MIT",
      "workflow": "Visual editor + C#",
      "website": "https://www.stride3d.net/",
      "source": "https://github.com/stride3d/stride",
      "notes": "C# engine with a full editor; especially strong for 3D and rendering."
    },
    {
      "name": "Bevy",
      "category": "general-2d-3d",
      "type": "engine",
      "dimensions": "2D + 3D",
      "languages": "Rust",
      "license": "MIT OR Apache-2.0",
      "workflow": "Code-first / ECS",
      "website": "https://bevy.org/",
      "source": "https://github.com/bevyengine/bevy",
      "notes": "Data-driven ECS engine; code-first rather than editor-first."
    },
    {
      "name": "Fyrox",
      "category": "general-2d-3d",
      "type": "engine",
      "dimensions": "2D + 3D",
      "languages": "Rust",
      "license": "MIT",
      "workflow": "Visual editor + Rust",
      "website": "https://fyrox.rs/",
      "source": "https://github.com/FyroxEngine/Fyrox",
      "notes": "Rust engine with integrated scene editor and 2D/3D support."
    },
    {
      "name": "Castle Game Engine",
      "category": "general-2d-3d",
      "type": "engine",
      "dimensions": "2D + 3D",
      "languages": "Object Pascal",
      "license": "LGPL-2.0-or-later + static-linking exception",
      "workflow": "Visual editor + code",
      "website": "https://castle-engine.io/",
      "source": "https://github.com/castle-engine/castle-engine",
      "notes": "Cross-platform 2D/3D engine with a visual editor; commercial closed-source games are supported under its exception."
    },
    {
      "name": "microStudio",
      "category": "general-2d-3d",
      "type": "engine",
      "dimensions": "2D + 3D",
      "languages": "microScript, JavaScript, Lua, Python",
      "license": "MIT",
      "workflow": "Browser/desktop editor + code",
      "website": "https://microstudio.dev/",
      "source": "https://github.com/pmgl/microstudio",
      "notes": "Small, approachable open-source engine with online collaboration and 2D/3D capabilities."
    },
    {
      "name": "LÖVE",
      "category": "2d-focused",
      "type": "framework",
      "dimensions": "2D",
      "languages": "Lua / C++",
      "license": "zlib",
      "workflow": "Code-first",
      "website": "https://love2d.org/",
      "source": "https://github.com/love2d/love",
      "notes": "Minimal, popular Lua framework for 2D games."
    },
    {
      "name": "HaxeFlixel",
      "category": "2d-focused",
      "type": "engine",
      "dimensions": "2D",
      "languages": "Haxe",
      "license": "MIT",
      "workflow": "Code-first",
      "website": "https://haxeflixel.com/",
      "source": "https://github.com/HaxeFlixel/flixel",
      "notes": "Cross-platform 2D engine built on Haxe/OpenFL."
    },
    {
      "name": "Solar2D",
      "category": "2d-focused",
      "type": "engine",
      "dimensions": "2D",
      "languages": "Lua / C++",
      "license": "MIT",
      "workflow": "Code-first + simulator",
      "website": "https://solar2d.com/",
      "source": "https://github.com/TRAGsoft/solar2d",
      "notes": "Formerly Corona SDK; focused on 2D mobile/desktop development."
    },
    {
      "name": "Phaser",
      "category": "2d-focused",
      "type": "framework",
      "dimensions": "2D",
      "languages": "JavaScript / TypeScript",
      "license": "MIT",
      "workflow": "Code-first / web",
      "website": "https://phaser.io/",
      "source": "https://github.com/phaserjs/phaser",
      "notes": "Widely used HTML5/WebGL 2D game framework."
    },
    {
      "name": "melonJS",
      "category": "2d-focused",
      "type": "engine",
      "dimensions": "2D / 2.5D",
      "languages": "JavaScript / TypeScript",
      "license": "MIT",
      "workflow": "Code-first / web",
      "website": "https://melonjs.org/",
      "source": "https://github.com/melonjs/melonJS",
      "notes": "Lightweight web engine with tilemaps, shaders and limited 3D mesh support."
    },
    {
      "name": "ct.js",
      "category": "2d-focused",
      "type": "engine",
      "dimensions": "2D",
      "languages": "JavaScript / TypeScript",
      "license": "MIT",
      "workflow": "Visual editor + scripting",
      "website": "https://ctjs.rocks/",
      "source": "https://github.com/ct-js/ct-js",
      "notes": "Desktop 2D engine/IDE designed to be friendly to beginners while remaining scriptable."
    },
    {
      "name": "Orx",
      "category": "2d-focused",
      "type": "engine",
      "dimensions": "2D",
      "languages": "C / C++",
      "license": "zlib",
      "workflow": "Data-driven + code",
      "website": "https://orx-project.org/",
      "source": "https://github.com/orx/orx",
      "notes": "Portable, data-driven 2D engine with a small runtime footprint."
    },
    {
      "name": "Torque2D",
      "category": "2d-focused",
      "type": "engine",
      "dimensions": "2D",
      "languages": "C++ / TorqueScript",
      "license": "MIT",
      "workflow": "Editor + scripting",
      "website": "https://torque3d.org/torque2d/",
      "source": "https://github.com/TorqueGameEngines/Torque2D",
      "notes": "Dedicated 2D Torque engine with Box2D, scripting and an actively evolving editor toolset."
    },
    {
      "name": "Open 3D Engine (O3DE)",
      "category": "3d-focused",
      "type": "engine",
      "dimensions": "3D",
      "languages": "C++ / Python / Lua",
      "license": "Apache-2.0",
      "workflow": "Full editor + code",
      "website": "https://o3de.org/",
      "source": "https://github.com/o3de/o3de",
      "notes": "Large-scale AAA-oriented 3D engine under the Linux Foundation."
    },
    {
      "name": "jMonkeyEngine",
      "category": "3d-focused",
      "type": "engine",
      "dimensions": "3D",
      "languages": "Java",
      "license": "BSD-3-Clause",
      "workflow": "SDK/editor + code",
      "website": "https://jmonkeyengine.org/",
      "source": "https://github.com/jMonkeyEngine/jmonkeyengine",
      "notes": "Mature Java 3D game engine and SDK."
    },
    {
      "name": "Panda3D",
      "category": "3d-focused",
      "type": "engine",
      "dimensions": "3D",
      "languages": "Python / C++",
      "license": "BSD-3-Clause",
      "workflow": "Code-first",
      "website": "https://www.panda3d.org/",
      "source": "https://github.com/panda3d/panda3d",
      "notes": "Mature 3D engine/framework originally developed by Disney and CMU."
    },
    {
      "name": "Wicked Engine",
      "category": "3d-focused",
      "type": "engine",
      "dimensions": "3D",
      "languages": "C++ / Lua",
      "license": "MIT",
      "workflow": "Editor + code / Lua",
      "website": "https://wickedengine.net/",
      "source": "https://github.com/turanszkij/WickedEngine",
      "notes": "Modern rendering-focused 3D engine with editor and Lua scripting."
    },
    {
      "name": "ezEngine",
      "category": "3d-focused",
      "type": "engine",
      "dimensions": "3D",
      "languages": "C++",
      "license": "MIT",
      "workflow": "Visual editor + C++ / visual scripting",
      "website": "https://ezengine.net/",
      "source": "https://github.com/ezEngine/ezEngine",
      "notes": "Feature-rich C++ engine with an integrated editor; Windows is its strongest platform."
    },
    {
      "name": "Armory3D",
      "category": "3d-focused",
      "type": "engine",
      "dimensions": "3D",
      "languages": "Haxe / C / C++",
      "license": "zlib",
      "workflow": "Blender-integrated",
      "website": "https://armory3d.org/",
      "source": "https://github.com/armory3d/armory",
      "notes": "3D engine tightly integrated into Blender."
    },
    {
      "name": "UPBGE",
      "category": "3d-focused",
      "type": "engine",
      "dimensions": "3D",
      "languages": "C++ / Python",
      "license": "GPL-3.0",
      "workflow": "Blender-integrated",
      "website": "https://upbge.org/",
      "source": "https://github.com/UPBGE/upbge",
      "notes": "Fork/continuation of the old Blender Game Engine, integrated directly into Blender."
    },
    {
      "name": "Torque3D",
      "category": "3d-focused",
      "type": "engine",
      "dimensions": "3D",
      "languages": "C++ / TorqueScript",
      "license": "MIT",
      "workflow": "Editor + scripting",
      "website": "https://torque3d.org/torque3d/",
      "source": "https://github.com/TorqueGameEngines/Torque3D",
      "notes": "Long-running C++ 3D engine with networking, world tools and scripting."
    },
    {
      "name": "rbfx (Rebel Fork)",
      "category": "3d-focused",
      "type": "engine/framework",
      "dimensions": "3D",